Świeca z prostowaniem nóg leżąc|TIME|SPLIT;FBW;FITNESS|20|SIXPACK| 1) Pozycja leżąca na plecach na macie. Ramiona proste, ustawione wzdłuż tułowia. 2) Kończyny dolne wyprostowane. Stopy lekko uniesione z podłoża. 3) Odcinek lędźwiowy kręgosłupa dotyka maty.| 1) Napinając mocno mięśnie brzucha, unieś kolana do klatki piersiowej.2) Kontynuuj ruch, aż miednica uniesie się w górę. Jest to warunek odpowiedniej pracy mięśni brzucha.3) W najwyższym punkcie zatrzymaj ruch na ułamek sekundy oraz wykonaj wydech.4) Następnie spokojnym kontrolowanym ruchem opuść kolana do pozycji początkowej.5) Wykonaj wyznaczoną liczbę powtórzeń.| 1) Mięśnie brzucha powinny być mocno napięte przez cały czas trwania ćwiczenia.2) Ćwiczenie wykonuj powoli, z pełnym wyczuciem zaangażowanej grupy mięśniowej.3) Skup się podczas wykonywania ruchu.4) Zwróć uwagę na prawidłowe oddychanie.|przyciaganie_kolan_do_klatki_w_zwisie_na_drazku.mp4
Unoszenie tułowia z podłoża. Spięcia brzucha leżąc|TIME|SPLIT;FBW;FITNESS|20|SIXPACK| Pozycja leżąca, kończyny dolne ugięte, stopy na podłodze, ręcewzdłuż tułowia.| 1) Napinając mocno mięśnie brzucha, ugnij tułów i unieś część piersiową. 2) Przytrzymaj ruch w maksymalnym napięciu mięśni brzucha przez ułamek sekundy, po czym wykonaj wydech powietrza. 3) Wróć do pozycji wyjściowej, wykonując płynny wdech. 4) Powtórz ugięcie. 5) Wykonaj zadanąliczbę powtórzeń.| 1) Mięśnie brzucha powinny być mocno napięte przez cały czas trwania ćwiczenia. 2) Ćwiczenie wykonuj powoli, z pełnym wyczuciem zaangażowanej grupy mięśniowej. 3) Skup się podczas wykonywania ruchu. 4) Zwróć uwagę na prawidłowe oddychanie. 5) Postaraj się skoncentrować napięcie na mięśniach brzucha, rozluźniając nogi i stopy. 6) Staraj się nie odrywać stóp od podłoża podczas wykonywania spięcia brzucha.|spiecia_brzucha_lezac_na_macie_ze_zlaczonymi_stopami.mp4
|||||| 1) Ugnij tułów do przodu, napinając mocno mięśnie brzucha i unosząc kręgosłup w części piersiowej. 2) Przytrzymaj ruch w maksymalnym napięciu mięśni brzucha przez ułamek sekundy, po czym wykonaj wydech. 3) Wróć do pozycji wyjściowej, wykonując płynny wdech powietrza. 4) Powtarzaj ugięcie. 5) Wykonaj wyznaczoną liczbę powtórzeń.| 1) Mięśnie brzucha powinny być mocno napięte przez cały czas trwania ćwiczenia. 2) Ćwiczenie wykonuj powoli, z pełnym wyczuciem zaangażowanej grupy mięśniowej. 3) Skup się podczas wykonywania ruchu. 4) Zwróć uwagę na prawidłowe oddychanie. 5) Postaraj się skoncentrować napięcie na mięśniach brzucha, rozluźniając nogi i stopy.|spiecia_brzucha_z_nogami_opartymi_na_pilce_gimnastycznej.mp4
|||||| 1) Angażując mocno dolną partię brzucha, ugnij nogi w kolanach i przyciągnij je do siebie tak, aby uda były ustawione prostopadle do podłoża. 2) Następnie wyprostuj nogi w kolanach i odrywając biodra od maty, postaraj się unieść nogi, ustawiając ciało prostopadle do podłoża. Wykonaj płynny wydech powietrza w czasie trwania tego ruchu. Pozycja podobna jak przy popularnej „świecy”. 3) Przytrzymaj ruch w maksymalnym napięciu mięśni brzucha przez ułamek sekundy. 4) Wróć do pozycji wyjściowej, wykonując płynny wdech powietrza. Kontroluj brzuchem fazę opadania bioder, nie odpuszczając napięcia mięśniowego. 5) Wykonaj zadaną liczbę powtórzeń.| 1) Mięśnie brzucha powinny być mocno napięte przez cały czas trwania ćwiczenia. 2) Ćwiczenie wykonuj powoli, z pełnym wyczuciem zaangażowanej grupy mięśniowej. 3) Skup się podczas wykonywania ruchu. 4) Zwróć uwagę na prawidłowe oddychanie. 5) Postaraj się skoncentrować napięcie na mięśniach brzucha.|swieca_z_prostowaniem_nog_lezac.mp4
|||||| 1) Wykonując wydech powietrza, ugnij tułów do przodu, napinając jednocześnie mocno mięśnie brzucha. 2) Przytrzymaj ruch w maksymalnym napięciu mięśni brzucha przez ułamek sekundy. 3) Wróć do pozycji wyjściowej, wykonując płynny wdech powietrza. 4) Powtórz ugięcie. 5) Wykonaj zadaną liczbę powtórzeń.| 1) Mięśnie brzucha powinny być mocno napięte przez cały czas trwania ćwiczenia. 2) Ćwiczenie wykonuj powoli, z pełnym wyczuciem zaangażowanej grupy mięśniowej. 3) Skup się podczas wykonywania ruchu. 4) Zwróć uwagę na prawidłowe oddychanie. 5) Postaraj się skoncentrować napięcie na mięśniach brzucha, rozluźniając nogi i stopy.|zginanie-tulowia-na-maszynie-siedzac-spiecia-brzucha-na-maszynie.mp4
|||||| 1)Weź wdech, unieś tułówdo pełnego siadu z jednoczesnym uniesieniem obu ramion, w końcowej fazie ruchu możesz wykonać wydech.2) Następnie, wdychając powietrze, wróć do pozycji wyjściowej. 3) Ponownie unieś tułów. 4) Wykonaj wyznaczoną liczbę powtórzeń.| 1) Mięśnie brzucha powinny być mocno napięte przez cały czas trwania ćwiczenia. 2) Ćwiczenie wykonuj powoli, z pełnym wyczuciem zaangażowanej grupy mięśniowej. 3) Skup się podczas wykonywania ruchu. 4) Zwróć uwagę na prawidłowe oddychanie.|unoszenie_tulowia_z_podloza_spiecia_brzucha_lezac.mp4
